<?xml version="1.0" encoding="UTF-8" standalone="no"?><!--
 * $Revision: 1.5 $ $Date: 2008-02-11 15:28:10 $ $Author: blohman $
 * 
 * Copyright (C) 2007  National Library of the Netherlands, Nationaal Archief of the Netherlands
 * 
 * This program is free software; you can redistribute it and/or
 * modify it under the terms of the GNU General Public License
 * as published by the Free Software Foundation; either version 2
 * of the License, or (at your option) any later version.
 * 
 * This program is distributed in the hope that it will be useful,
 * but WITHOUT ANY WARRANTY; without even the implied warranty of
 * MERCHANTABILITY or FITNESS FOR A PARTICULAR PURPOSE.  See the
 * GNU General Public License for more details.
 * 
 * You should have received a copy of the GNU General Public License
 * along with this program; if not, write to the Free Software
 * Foundation, Inc., 51 Franklin Street, Fifth Floor, Boston, MA  02110-1301, USA.
 *
 * For more information about this project, visit
 * http://dioscuri.sourceforge.net/
 * or contact us via email:
 * jrvanderhoeven at users.sourceforge.net
 * blohman at users.sourceforge.net
 * 
 * Developed by:
 * Nationaal Archief               <www.nationaalarchief.nl>
 * Koninklijke Bibliotheek         <www.kb.nl>
 * Tessella Support Services plc   <www.tessella.com>
 *
 * Project Title: DIOSCURI
--><!-- Defines Dioscuri Emulator modules and settings --><emulator xmlns:xsi="http://www.w3.org/2001/XMLSchema-instance" debug="false" xsi:noNamespaceSchemaLocation="DioscuriConfig.xsd">
   <!-- Devines the boot sequence -->
   
   <!-- Defines the architecture required -->
   <architecture name="Von Neumann">
      
      <modules>
      
         <!-- Defines the Bios module -->
         <bios>
			 <sysbiosfilepath>/share/Bram/dioscuri_SF_dev/images/bios/BIOS-bochs-latest</sysbiosfilepath>        
            <vgabiosfilepath>/share/Bram/dioscuri_SF_dev/images/bios/VGABIOS-lgpl-latest</vgabiosfilepath>
            <ramaddresssysbiosstartdec>983040</ramaddresssysbiosstartdec>
            <ramaddressvgabiosstartdec>786432</ramaddressvgabiosstartdec>
			<bootdrives> 
				<bootdrive0>harddrive</bootdrive0>
				<bootdrive1>none</bootdrive1>
				<bootdrive2>none</bootdrive2>
			</bootdrives>
			<floppycheckdisabled>true</floppycheckdisabled>
		</bios>
            
         <!-- Defines the cpu module -->
         <cpu debug="false">
		 	<cpu32bit>true</cpu32bit>
			<speedmhz>5</speedmhz>
		</cpu> 
		 <!-- Defines the memory module-->
		 <memory debug="false" debugaddressdecimal="9295">
			 <sizemb>1</sizemb>
		 </memory>
	
         <!-- Defines the floppy drive controller module -->
	 	 <fdc debug="false"> <!-- normally 300 microseconds -->
			 <updateintervalmicrosecs>250</updateintervalmicrosecs>
			 <floppy>
             	<enabled>true</enabled>
             	<inserted>true</inserted>
             	<driveletter>A</driveletter>
             	<diskformat>1.44M</diskformat>
             	<writeprotected>false</writeprotected>
	         	<imagefilepath>/home/bram/shareBram/dioscuri_SF_dev/images/floppy/games1.ima</imagefilepath>
	       </floppy>
        </fdc>
        
        <!-- Defines the PIT module -->
 		<pit debug="false">
			<clockrate>5</clockrate>
		</pit>
 		
        <!-- Defines the keyboard module -->
        <keyboard debug="false">
			<updateintervalmicrosecs>200</updateintervalmicrosecs>
		</keyboard>
        
         <!-- Defines the Mouse module -->
         <mouse debug="false">
			 <mousetype>ps/2</mousetype>
		 </mouse>

        <!-- Defines the ata module -->
	    <ata debug="false">
			<updateintervalmicrosecs>100000</updateintervalmicrosecs>
			<harddiskdrive>
               <enabled>true</enabled>
               <channelindex>0</channelindex>
               <master>true</master>
               <autodetectcylinders>true</autodetectcylinders>
               <cylinders>0</cylinders>
	   	       <heads>4</heads>
               <sectorspertrack>17</sectorspertrack>
               <imagefilepath>/share/Bram/dioscuri_SF_dev/images/floppy/MSDOS5_gms_masm_wp51.img</imagefilepath>
            </harddiskdrive>
        </ata>
        
        <!-- Defines the video module -->
        <video debug="false">
			<updateintervalmicrosecs>40000</updateintervalmicrosecs>
		</video>
		
      </modules>
           
   </architecture>
</emulator>